TransactionID,AccountID,FundID,TransactionType,Amount,TransactionDate,Notes
TR1798,AC101,DODWX,withdrawal,81720.12,2023-05-26,Eat memory onto check share however whether.
TR1799,AC101,DODLX,deposit,68400.46,2023-10-25,Join report to price official not moment.
TR1800,AC101,DODIX,sell,78462.02,2024-02-04,Then adult newspaper everyone father company success.
TR1801,AC101,DODLX,sell,92999.73,2024-04-13,Soldier walk thing baby.
TR1802,AC101,DODBX,buy,11571.32,2024-05-01,Could agree pretty agent chair stuff station.
TR1803,AC101,DODWX,withdrawal,98564.58,2024-05-06,Light one them position buy.
TR1804,AC102,DODWX,withdrawal,91434.59,2024-05-01,Force trouble thank heart finally role.
TR1805,AC102,DODBX,dividend reinvestment,48292.94,2023-06-20,Test business little.
TR1806,AC102,DODFX,sell,51781.6,2023-04-11,Least Republican window me kitchen necessary might.
TR1807,AC102,DODBX,transfer,89470.65,2023-12-07,Couple page always no.
TR1808,AC102,DODFX,deposit,45281.39,2024-03-01,Program husband represent control recent follow.
TR1809,AC102,DODLX,transfer,36645.23,2024-02-13,Site mouth when fund send family analysis.
TR1810,AC102,DODBX,deposit,61833.74,2023-03-05,Likely know available.
TR1811,AC102,DODBX,deposit,87083.81,2023-05-22,Next show rise four drive leave decide.
TR1812,AC102,DODGX,dividend reinvestment,37551.98,2023-02-05,Cover goal strong particularly without such.
TR1813,AC102,DODLX,sell,99158.69,2023-12-27,Series quickly military population he start level.
TR1814,AC102,DODWX,sell,32847.68,2023-10-03,Book indicate rule take.
TR1815,AC102,DODBX,dividend reinvestment,19347.52,2023-03-06,Son even western possible store report.
TR1816,AC102,DODIX,dividend reinvestment,90572.17,2023-10-17,Player wonder data child.
TR1817,AC102,DODLX,sell,52593.33,2023-11-11,Listen work might live black whatever.
TR1818,AC102,DODBX,dividend reinvestment,91134.48,2024-05-11,More everything need response system.
TR1819,AC102,DODWX,deposit,90653.61,2024-03-09,Simple with American card anything statement remember.
TR1820,AC102,DODWX,withdrawal,12556.6,2024-03-26,And interview have class idea discussion.
TR1821,AC102,DODGX,buy,16352.67,2024-01-21,Interest the generation not gun.
TR1822,AC102,DODWX,deposit,75069.76,2023-11-17,Shake interesting writer book prove health ability.
TR1823,AC102,DODGX,transfer,22992.01,2023-09-09,Certainly I Democrat yes easy decision ask.
TR1824,AC102,DODIX,dividend reinvestment,32150.0,2023-08-17,Detail sign team area resource water really evidence.
TR1825,AC103,DODWX,buy,13188.2,2023-09-01,Part current style most option well.
TR1826,AC103,DODWX,buy,43436.69,2023-10-07,Until husband can ok lose minute.
TR1827,AC103,DODGX,withdrawal,29297.83,2023-03-07,Medical around reason future.
TR1828,AC103,DODIX,withdrawal,94476.13,2023-06-24,Change clear reveal everyone but direction drive.
TR1829,AC103,DODWX,deposit,90738.17,2024-05-06,There appear research here.
TR1830,AC103,DODGX,transfer,12174.28,2023-05-31,Start language respond sit message hit.
TR1831,AC103,DODIX,dividend reinvestment,96675.9,2023-12-31,Work hold learn role black process red.
TR1832,AC103,DODFX,withdrawal,17100.26,2023-06-24,Relate too every art lead.
TR1833,AC104,DODIX,deposit,27019.72,2023-02-23,Rather walk recognize always physical director mind.
TR1834,AC104,DODWX,transfer,80552.64,2023-12-29,Information face PM cause pattern here.
TR1835,AC104,DODLX,deposit,39557.01,2023-10-08,Check figure against its approach reveal act future.
TR1836,AC104,DODIX,deposit,35029.86,2024-04-12,Wait last mouth dog say area fund.
TR1837,AC104,DODLX,withdrawal,17572.74,2023-10-08,Study role clear relate can lose.
TR1838,AC104,DODBX,sell,50761.3,2023-09-28,Close job usually realize door necessary.
TR1839,AC104,DODWX,buy,98225.8,2023-10-27,Social little college understand training.
TR1840,AC104,DODWX,deposit,40551.0,2023-07-03,Central western us onto send huge.
TR1841,AC104,DODLX,transfer,74506.78,2024-05-05,History who deep piece.
TR1842,AC104,DODGX,buy,29536.58,2024-05-23,Section nice worry probably and arrive.
TR1843,AC104,DODIX,buy,43289.2,2024-05-27,College event Republican fly gas data.
TR1844,AC104,DODLX,dividend reinvestment,6499.39,2023-02-12,Girl also could.
TR1845,AC105,DODFX,transfer,228.11,2024-05-18,Bank speak charge computer say newspaper get.
TR1846,AC105,DODIX,dividend reinvestment,76202.6,2023-07-19,Hot though present which response writer.
TR1847,AC105,DODFX,dividend reinvestment,87908.1,2023-07-28,Water turn paper data stand.
TR1848,AC105,DODWX,transfer,3798.7,2023-01-07,Game space become election street sign.
TR1849,AC105,DODLX,dividend reinvestment,63021.4,2023-07-02,Wish spring out face after.
TR1850,AC105,DODFX,buy,3362.98,2024-05-29,Fly realize I box wide win data.
TR1851,AC105,DODBX,transfer,62042.54,2023-03-06,Political first citizen law off institution eye society.
TR1852,AC105,DODLX,deposit,40223.16,2023-08-23,Law professional guess kind.
TR1853,AC105,DODGX,withdrawal,12013.44,2023-03-02,Safe yeah arrive line hundred operation stop leave.
TR1854,AC105,DODIX,deposit,62584.25,2023-04-13,Site now human player by participant them.
TR1855,AC105,DODBX,dividend reinvestment,71463.09,2023-04-03,Economy think sure door this both force.
TR1856,AC105,DODBX,sell,48459.21,2023-12-19,Project itself want structure.
TR1857,AC105,DODBX,withdrawal,27245.32,2023-04-15,Painting land stage line per physical.
TR1858,AC105,DODLX,sell,52514.1,2023-04-08,My site eat house.
TR1859,AC105,DODFX,sell,84538.1,2023-10-24,Movement inside past computer in per show will.
TR1860,AC105,DODFX,deposit,2311.55,2023-03-24,Own especially performance very represent argue piece.
TR1861,AC105,DODWX,dividend reinvestment,56574.42,2023-01-25,Hold director floor remain point special.
TR1862,AC105,DODWX,deposit,19348.78,2024-02-04,Nature yeah he leave pass take position.
TR1863,AC105,DODBX,deposit,48222.71,2023-02-18,Anything bar really close.
TR1864,AC105,DODGX,buy,25485.43,2023-12-06,Production experience ground sing.
TR1865,AC105,DODWX,withdrawal,49816.77,2023-10-12,Black blue statement may common.
TR1866,AC105,DODFX,dividend reinvestment,71906.86,2023-12-20,Wife leave two economy though speech kid back.
TR1867,AC105,DODIX,deposit,88913.76,2023-09-30,Brother maintain finally appear section collection.
TR1868,AC106,DODWX,dividend reinvestment,11812.73,2023-09-29,Environmental cost bar from simple fight sure.
TR1869,AC106,DODWX,withdrawal,13058.98,2024-02-16,Culture project drop leader.
TR1870,AC106,DODFX,transfer,38807.42,2023-08-16,Him player his history road activity much.
TR1871,AC106,DODIX,transfer,9320.39,2024-05-30,Stand one rather still.
TR1872,AC106,DODWX,withdrawal,41798.78,2023-11-29,Hair full while character.
TR1873,AC106,DODGX,deposit,57036.75,2023-01-30,Population phone crime term official.
TR1874,AC106,DODBX,withdrawal,22458.83,2023-05-07,Will listen claim able operation majority simple her.
TR1875,AC106,DODFX,sell,65891.1,2023-10-18,Entire mean price stand scene head.
TR1876,AC106,DODWX,dividend reinvestment,53712.03,2023-01-06,Surface rate strong car fact short turn town.
TR1877,AC106,DODIX,dividend reinvestment,61119.36,2023-01-16,Consider see develop wear government investment.
TR1878,AC106,DODLX,buy,68193.85,2023-10-29,Argue break degree agency they.
TR1879,AC106,DODGX,buy,93681.97,2023-05-30,Material effect she meeting information night.
TR1880,AC106,DODBX,transfer,13865.48,2023-05-13,Conference always enter account organization yourself hundred society.
TR1881,AC106,DODBX,transfer,82868.43,2024-02-22,Popular seven answer citizen change.
TR1882,AC107,DODIX,transfer,53769.77,2023-05-01,Involve plant financial even reduce accept.
TR1883,AC107,DODFX,deposit,24371.95,2023-01-30,Late also fight feeling always yourself.
TR1884,AC107,DODGX,dividend reinvestment,34396.19,2023-08-07,Easy table key member.
TR1885,AC107,DODFX,sell,86159.63,2024-03-30,Against far shoulder middle information one.
TR1886,AC107,DODIX,deposit,64467.4,2024-04-11,Different that president phone.
TR1887,AC107,DODWX,dividend reinvestment,8839.92,2024-04-24,Perhaps research artist third.
TR1888,AC107,DODFX,dividend reinvestment,65557.56,2023-07-04,Our out brother law quality.
TR1889,AC108,DODBX,withdrawal,42282.44,2024-01-22,Such let home model.
TR1890,AC108,DODWX,sell,49849.65,2023-02-20,Carry individual husband traditional.
TR1891,AC108,DODGX,withdrawal,58637.77,2023-04-30,Throw would season mother really.
TR1892,AC108,DODFX,withdrawal,82050.05,2023-01-27,Method offer suffer consider.
TR1893,AC108,DODIX,dividend reinvestment,96444.38,2023-08-20,Happy skin key society century support majority.
TR1894,AC108,DODFX,withdrawal,84639.99,2023-11-27,Democratic serve professional rate side rest.
TR1895,AC108,DODLX,dividend reinvestment,7340.76,2023-05-24,Data professional eat actually rich protect image.
TR1896,AC108,DODIX,transfer,35641.44,2023-05-19,Audience build oil two well.
TR1897,AC108,DODBX,dividend reinvestment,65121.03,2023-01-25,Century nor send performance doctor.
TR1898,AC108,DODIX,sell,11974.9,2024-05-06,Wall goal number impact.
TR1899,AC108,DODIX,withdrawal,8209.12,2024-05-30,Accept evening sign wall however.
TR1900,AC108,DODIX,buy,39295.14,2023-02-11,Character think bed development technology long clearly.
TR1901,AC108,DODBX,withdrawal,36692.02,2024-01-27,See accept floor quickly score face need.
TR1902,AC108,DODFX,withdrawal,31994.91,2023-03-22,Probably strong measure relate increase.
TR1903,AC109,DODIX,sell,29325.16,2024-01-29,My artist people view develop now tax first.
TR1904,AC109,DODLX,sell,92306.46,2023-03-09,Would military over one.
TR1905,AC109,DODWX,buy,25863.99,2023-12-08,Card but really baby recognize data call.
TR1906,AC109,DODWX,buy,13415.29,2024-04-11,Hand financial cold heart most radio.
TR1907,AC109,DODWX,withdrawal,32181.91,2024-05-04,Fight change information shake also.
TR1908,AC109,DODLX,dividend reinvestment,35367.98,2023-06-20,Music trial than management.
TR1909,AC109,DODFX,transfer,86624.62,2023-09-11,Choose especially field economic.
TR1910,AC110,DODLX,deposit,26418.01,2023-04-18,Public later trade send hear rise student.
TR1911,AC110,DODWX,transfer,28748.71,2023-03-02,But not spend test first.
TR1912,AC110,DODFX,transfer,91257.05,2023-10-01,About similar condition job either team.
TR1913,AC110,DODFX,deposit,40990.72,2023-12-26,Happy entire cell team medical behind.
TR1914,AC110,DODGX,withdrawal,9014.28,2024-04-02,Remember various into yeah should.
TR1915,AC110,DODFX,withdrawal,41771.54,2024-01-16,Cut spring east dog.
TR1916,AC110,DODFX,buy,17122.19,2024-04-20,Smile most democratic control question author court.
TR1917,AC110,DODFX,dividend reinvestment,80050.71,2023-02-14,Energy agree admit husband might believe last.
TR1918,AC110,DODWX,buy,687.16,2023-11-13,Week what director that good organization quickly.
TR1919,AC110,DODFX,buy,55699.55,2023-03-06,Something over wall player result.
TR1920,AC110,DODLX,withdrawal,98595.97,2023-08-16,Memory high board.
TR1921,AC110,DODBX,deposit,67642.57,2023-09-04,Analysis respond give forget.
TR1922,AC110,DODLX,buy,65650.31,2024-03-29,Candidate sea since keep.
TR1923,AC110,DODWX,sell,27275.6,2023-08-17,Career man church total.
TR1924,AC110,DODWX,dividend reinvestment,79283.05,2024-04-22,Music country available.
TR1925,AC110,DODLX,deposit,64325.49,2024-02-09,Area class create grow.
TR1926,AC110,DODIX,buy,35060.44,2023-12-04,Yet really available impact.
TR1927,AC110,DODGX,transfer,51355.42,2024-03-27,Surface set yeah write yeah.
TR1928,AC110,DODBX,transfer,36662.75,2024-03-11,Onto doctor table nor help.
TR1929,AC110,DODLX,buy,19075.45,2023-11-11,Side toward heart popular allow amount.
TR1930,AC110,DODFX,withdrawal,69906.77,2023-01-16,Baby instead after college team certainly wrong.
TR1931,AC110,DODIX,transfer,52002.58,2023-11-15,Similar statement create finally born situation.
TR1932,AC110,DODLX,dividend reinvestment,86067.31,2024-03-10,Use significant natural rest think that.
TR1933,AC110,DODBX,deposit,79802.79,2023-02-26,Form traditional it specific.
TR1934,AC110,DODLX,dividend reinvestment,35261.93,2023-07-13,Single current marriage why teacher.
TR1935,AC110,DODLX,buy,48081.57,2024-01-20,Would method choice care line training.
TR1936,AC110,DODGX,transfer,99923.31,2023-02-03,Board out southern when.
TR1937,AC110,DODBX,deposit,78276.39,2023-12-26,Them policy teach.
TR1938,AC111,DODLX,sell,84533.92,2023-04-10,Close move want wonder plan oil.
TR1939,AC111,DODLX,buy,42027.87,2024-05-08,Somebody example record pull head participant.
TR1940,AC111,DODBX,transfer,27203.92,2024-01-22,Operation home the reduce third foot.
TR1941,AC111,DODIX,deposit,13839.87,2023-07-13,Later film subject drive court up hit.
TR1942,AC111,DODLX,withdrawal,30334.18,2023-11-27,Dinner line modern billion the if nation.
TR1943,AC111,DODGX,sell,32620.63,2023-08-17,Serious ahead community interesting get summer information particularly.
TR1944,AC111,DODWX,deposit,11967.66,2023-05-12,Business myself career.
TR1945,AC111,DODBX,deposit,26983.25,2023-08-09,Little myself technology sort.
TR1946,AC111,DODIX,sell,63515.68,2024-01-05,Face seem traditional company eight.
TR1947,AC111,DODWX,deposit,92552.87,2023-07-16,Win make coach effect throughout.
TR1948,AC111,DODWX,sell,67800.91,2023-05-20,Ten defense travel age.
TR1949,AC111,DODGX,buy,10207.46,2023-09-30,Page store magazine defense realize notice forward.
TR1950,AC111,DODFX,withdrawal,71755.89,2023-09-29,Lay today message interesting wonder choice.
TR1951,AC111,DODBX,transfer,27902.31,2024-05-02,Significant with face owner public growth happy.
TR1952,AC111,DODBX,withdrawal,64629.84,2023-07-20,Conference kid value how firm hot.
TR1953,AC111,DODLX,dividend reinvestment,62083.45,2024-03-13,Citizen look near lot.
TR1954,AC111,DODFX,transfer,5384.68,2023-06-23,Measure relationship against choice.
TR1955,AC111,DODLX,transfer,26694.1,2024-03-15,Paper director few beautiful name.
TR1956,AC111,DODGX,withdrawal,14711.8,2023-07-24,Husband manager energy attack.
TR1957,AC111,DODLX,sell,44505.52,2024-03-15,Wish lead information Mr store common big.
TR1958,AC111,DODLX,deposit,275.97,2024-04-03,Artist military need company especially government area mission.
TR1959,AC112,DODGX,deposit,54004.15,2023-07-20,Article yourself the.
TR1960,AC112,DODBX,dividend reinvestment,10449.2,2023-05-17,Author over speak bed agent.
TR1961,AC112,DODLX,transfer,36587.21,2023-08-10,Especially fire two simple bill there.
TR1962,AC112,DODLX,deposit,7073.85,2023-01-22,Eye end expert claim.
TR1963,AC112,DODLX,deposit,75471.65,2023-04-18,Pay peace gun despite.
TR1964,AC112,DODIX,sell,84332.62,2023-11-14,Room positive effort painting.
TR1965,AC112,DODWX,sell,39462.37,2024-05-27,Full seem news relate PM far.
TR1966,AC112,DODIX,dividend reinvestment,59576.81,2023-06-17,Field would decade sense protect.
TR1967,AC112,DODGX,buy,70348.74,2023-04-07,Environmental arrive she so American position.
TR1968,AC112,DODGX,transfer,93960.52,2023-12-22,Southern manage probably morning.
TR1969,AC112,DODLX,deposit,44799.04,2023-04-02,Improve couple recently almost fall class citizen.
TR1970,AC112,DODWX,sell,79826.22,2023-04-07,Somebody season might his attack see.
TR1971,AC112,DODLX,dividend reinvestment,35543.85,2023-11-26,President take need wide spring.
TR1972,AC112,DODGX,buy,59312.23,2023-10-07,Organization recent three such free national.
TR1973,AC112,DODFX,deposit,87374.33,2023-10-31,Maintain before color value plant important.
TR1974,AC112,DODGX,sell,19812.43,2023-03-25,Summer raise be federal center which story.
TR1975,AC112,DODGX,dividend reinvestment,33895.38,2024-01-25,Sense deep decision special official.
TR1976,AC113,DODFX,buy,50320.78,2024-04-08,Analysis include off risk reduce.
TR1977,AC113,DODFX,deposit,12107.2,2024-02-18,Until house them heart seek.
TR1978,AC113,DODGX,buy,23175.05,2024-01-13,Response ready sit why old get without significant.
TR1979,AC113,DODLX,transfer,66698.5,2024-04-26,Chair green ability.
TR1980,AC113,DODLX,dividend reinvestment,67004.37,2023-09-10,Source real up gas worry nearly democratic.
TR1981,AC113,DODLX,dividend reinvestment,56742.04,2023-09-06,Sign early marriage nothing mother order prepare.
TR1982,AC113,DODBX,transfer,55105.93,2023-04-21,Wind can cover improve word.
TR1983,AC113,DODGX,transfer,46956.09,2024-02-29,Usually decision house wind apply above.
TR1984,AC113,DODLX,dividend reinvestment,67454.7,2024-04-11,Rest citizen tonight.
TR1985,AC113,DODLX,dividend reinvestment,98351.33,2023-03-21,Along wrong woman surface summer whatever.
TR1986,AC113,DODBX,buy,39690.57,2023-06-05,Try poor onto any.
TR1987,AC113,DODFX,buy,88178.48,2023-03-02,Manager expert effect.
TR1988,AC113,DODGX,deposit,41043.31,2023-01-10,Each as lay somebody believe idea.
TR1989,AC114,DODWX,dividend reinvestment,57134.99,2024-05-01,Could spring dream form accept.
TR1990,AC114,DODGX,deposit,9667.77,2024-01-16,Ten person up debate law west employee.
TR1991,AC114,DODWX,dividend reinvestment,25695.1,2023-02-18,Structure common health nice agree series.
TR1992,AC114,DODIX,sell,73917.21,2023-08-19,Choose consider training show data throughout within.
TR1993,AC114,DODGX,dividend reinvestment,90398.45,2023-07-05,Himself help those economic sit music.
TR1994,AC114,DODIX,deposit,96115.91,2023-08-14,Per bed there experience have your effort.
TR1995,AC114,DODFX,buy,16117.62,2023-06-28,Marriage occur cultural country class few feeling.
TR1996,AC114,DODWX,transfer,93087.5,2023-01-09,Country different partner paper.
TR1997,AC114,DODLX,deposit,54402.94,2023-05-30,Method prevent business quality relate physical other.
TR1998,AC114,DODIX,deposit,87350.25,2024-01-31,Cover think growth begin research.
TR1999,AC114,DODBX,buy,19546.11,2023-04-10,Total not similar idea son important attorney difference.
TR2000,AC114,DODLX,dividend reinvestment,77596.3,2024-02-11,Draw light government dinner wait instead.
TR2001,AC114,DODIX,deposit,39940.42,2024-04-18,Would over computer because least.
TR2002,AC114,DODLX,withdrawal,94364.3,2024-02-04,Discuss others option international ball wind for summer.
TR2003,AC114,DODWX,dividend reinvestment,96728.63,2023-11-03,Mission street identify anyone event ground past remain.
TR2004,AC114,DODBX,buy,84235.94,2024-03-03,Front create blood game they kitchen board.
TR2005,AC114,DODLX,deposit,7903.84,2024-02-23,Relationship cell mouth.
TR2006,AC114,DODGX,deposit,66313.57,2023-03-21,Arm heart list project western.
TR2007,AC115,DODWX,sell,49826.24,2023-07-04,Speech director sport off.
TR2008,AC115,DODGX,buy,58038.79,2024-01-17,Just mission your administration offer soon.
TR2009,AC115,DODFX,transfer,43960.47,2023-09-01,Staff large dream Democrat able.
TR2010,AC115,DODGX,withdrawal,60215.58,2023-12-22,Hard economic happy media person glass.
TR2011,AC115,DODIX,transfer,92350.67,2023-09-13,Include particularly pull sort bar.
TR2012,AC115,DODLX,dividend reinvestment,48019.34,2023-12-13,Likely believe man exist thousand business race.
TR2013,AC115,DODIX,dividend reinvestment,86202.35,2023-03-20,Here agent message research evening at either.
TR2014,AC115,DODIX,dividend reinvestment,59172.61,2023-03-28,Need moment machine whom.
TR2015,AC115,DODIX,buy,48124.88,2023-02-28,Student manage and black sea student miss.
TR2016,AC115,DODLX,withdrawal,34688.57,2023-03-17,Place weight be where school until.
TR2017,AC115,DODLX,deposit,44664.78,2023-08-01,Best someone develop debate ever.
TR2018,AC115,DODIX,buy,98625.58,2023-02-13,Human mean effort power wrong.
TR2019,AC115,DODLX,buy,95488.53,2023-01-17,Old appear cost.
TR2020,AC115,DODGX,withdrawal,55481.03,2023-10-20,Set authority economic lead anything subject follow.
TR2021,AC115,DODIX,buy,22082.15,2024-01-09,Step vote any event.
TR2022,AC115,DODLX,dividend reinvestment,84979.61,2023-06-23,Oil role future military.
TR2023,AC115,DODBX,transfer,9094.57,2024-03-13,Understand argue most.
TR2024,AC115,DODFX,dividend reinvestment,97646.79,2023-06-08,Right process sport into should significant.
TR2025,AC115,DODBX,dividend reinvestment,46034.95,2024-05-10,Reduce lose Mrs station century.
TR2026,AC115,DODFX,dividend reinvestment,20881.8,2024-01-06,Boy word simple center effect consumer follow assume.
TR2027,AC115,DODFX,dividend reinvestment,626.56,2023-08-03,Mouth shoulder total have.
TR2028,AC115,DODIX,buy,24908.04,2023-05-06,Property fear like fast.
TR2029,AC115,DODBX,dividend reinvestment,90190.25,2024-02-07,Beautiful will would speak.
TR2030,AC115,DODGX,buy,83819.23,2024-05-15,Heavy teach keep store foot government.
TR2031,AC115,DODIX,dividend reinvestment,82674.27,2024-04-17,Difficult something dog.
TR2032,AC115,DODLX,sell,61299.39,2024-03-28,Pattern response town successful expert out fly.
TR2033,AC116,DODWX,deposit,57118.51,2023-10-31,Of defense Mr visit.
TR2034,AC116,DODWX,withdrawal,81880.75,2023-01-29,Garden state hold ever even look only.
TR2035,AC116,DODBX,sell,81569.37,2023-09-13,Rule yeah without onto half box memory.
TR2036,AC116,DODLX,withdrawal,94087.14,2023-10-26,Pay cell ready shake.
TR2037,AC116,DODIX,sell,33548.22,2024-02-14,Model will media industry magazine outside property.
TR2038,AC116,DODWX,buy,84646.37,2023-07-08,Remember by age heart shake town change.
TR2039,AC116,DODIX,dividend reinvestment,65296.74,2023-09-04,Purpose reveal grow paper.
TR2040,AC117,DODFX,deposit,4705.49,2023-03-01,Lead since structure quite smile past condition.
TR2041,AC117,DODGX,transfer,81060.5,2023-05-27,Yourself item sometimes call.
TR2042,AC117,DODIX,deposit,71353.01,2023-05-23,Hold pretty human poor claim everyone.
TR2043,AC117,DODBX,buy,93082.87,2024-04-11,Tough improve single top institution.
TR2044,AC117,DODGX,withdrawal,29065.74,2023-12-08,Direction statement improve tonight.
TR2045,AC117,DODIX,buy,46070.53,2023-11-20,Suggest sing career anything adult pull bring enough.
TR2046,AC117,DODBX,buy,38760.18,2023-05-16,Land until size including east who play.
TR2047,AC117,DODFX,dividend reinvestment,58737.16,2023-02-22,Allow cost company by itself pretty.
TR2048,AC117,DODIX,deposit,30481.67,2023-09-14,Surface available effort election.
TR2049,AC117,DODIX,sell,17231.94,2024-05-07,Yard should student reveal wish this cut throughout.
TR2050,AC117,DODBX,deposit,38440.54,2023-07-04,Culture at sense answer.
TR2051,AC117,DODIX,transfer,28470.3,2023-03-08,While own southern force avoid.
TR2052,AC117,DODWX,buy,63381.7,2023-03-26,Thank black down standard everyone management.
TR2053,AC117,DODFX,dividend reinvestment,95478.21,2023-04-13,Life memory future issue just.
TR2054,AC117,DODLX,deposit,33791.27,2023-01-28,Value child miss yes wall PM beat.
TR2055,AC117,DODIX,dividend reinvestment,49754.45,2024-01-28,Resource moment building really herself analysis day.
TR2056,AC117,DODGX,sell,23295.79,2023-02-19,Control book real gun happen.
TR2057,AC117,DODWX,sell,31819.37,2023-05-12,Tell other by certainly blue agent.
TR2058,AC117,DODLX,sell,18072.29,2024-04-15,Guess professional walk realize degree.
TR2059,AC117,DODLX,deposit,86115.52,2023-01-16,Really their force probably mouth reason than.
TR2060,AC117,DODGX,dividend reinvestment,4974.46,2024-04-09,Environment discover according free easy end.
TR2061,AC117,DODGX,withdrawal,31887.67,2023-11-08,Candidate identify stand yourself fill.
TR2062,AC117,DODIX,dividend reinvestment,61576.49,2023-01-03,Its likely politics name real.
TR2063,AC117,DODLX,withdrawal,90971.47,2023-01-28,Such rule successful do green traditional.
TR2064,AC117,DODWX,dividend reinvestment,19787.25,2023-10-14,Relationship recognize offer food maintain billion claim program.
TR2065,AC117,DODFX,dividend reinvestment,35921.09,2023-11-29,Yard writer section money road season sign.
TR2066,AC117,DODFX,buy,3778.93,2024-04-29,Possible raise stuff body.
TR2067,AC117,DODWX,buy,24790.72,2023-05-25,Under some shake leader.
TR2068,AC118,DODIX,deposit,92032.42,2023-08-11,Stuff in measure design region.
TR2069,AC118,DODBX,buy,94162.86,2023-08-22,Wish approach themselves wear page health.
TR2070,AC118,DODIX,sell,9400.89,2024-05-14,Order life hold pretty.
TR2071,AC118,DODBX,dividend reinvestment,23147.48,2024-04-27,Expert hour detail family do old thing voice.
TR2072,AC118,DODIX,deposit,80920.85,2023-06-21,Common property drive he program.
TR2073,AC118,DODWX,buy,3174.37,2023-06-23,Decade trade too.
TR2074,AC118,DODIX,transfer,91587.43,2023-12-09,Color customer social major group must choose.
TR2075,AC118,DODFX,deposit,92111.67,2024-03-22,Carry college young front color car.
TR2076,AC118,DODLX,buy,24437.97,2024-05-17,Apply show get beautiful between.
TR2077,AC118,DODFX,withdrawal,59268.34,2023-01-31,Around gun team almost.
TR2078,AC118,DODFX,buy,2948.34,2023-07-17,Him ability other manager pay describe.
TR2079,AC119,DODIX,buy,86436.39,2023-06-27,Instead prove research onto turn billion reduce.
TR2080,AC119,DODIX,transfer,97056.53,2023-09-16,Seem thing bed everything.
TR2081,AC119,DODWX,transfer,58173.36,2023-12-21,Concern stand star total daughter modern seem.
TR2082,AC119,DODGX,buy,31935.6,2024-05-11,Century door research year coach total.
TR2083,AC119,DODBX,deposit,24287.76,2024-01-03,One data magazine often staff paper.
TR2084,AC120,DODFX,deposit,32349.23,2023-01-24,Heart exactly here everything former.
TR2085,AC120,DODWX,dividend reinvestment,37779.57,2023-05-19,Kitchen gas where.
TR2086,AC120,DODLX,deposit,68406.13,2024-03-20,Better value my economy television music add.
TR2087,AC120,DODLX,withdrawal,19412.31,2023-03-01,Wear than office ground when entire trouble.
TR2088,AC120,DODGX,dividend reinvestment,8075.77,2023-01-27,Can even yourself major.
TR2089,AC120,DODWX,withdrawal,56616.75,2023-03-02,Civil almost unit experience speak executive.
TR2090,AC120,DODGX,deposit,68678.25,2023-01-02,Official stock factor husband same budget avoid.
TR2091,AC120,DODLX,sell,93185.57,2023-05-11,Nearly one include make.
