TransactionID,AccountID,FundID,TransactionType,Amount,TransactionDate,Notes
TR0001,AC001,DODIX,transfer,57187.7,2023-11-11,Eye more suffer wide fact talk one.
TR0002,AC001,DODBX,transfer,87503.81,2024-05-07,Service modern past thing.
TR0003,AC001,DODLX,transfer,67399.58,2023-10-17,Kind every investment break free civil.
TR0004,AC001,DODFX,deposit,16138.36,2023-05-18,Four represent behavior sometimes usually.
TR0005,AC001,DODWX,sell,91944.07,2023-03-12,Wrong TV nation idea establish car specific.
TR0006,AC001,DODBX,buy,93553.89,2023-10-13,Black kitchen although head whatever imagine.
TR0007,AC001,DODLX,withdrawal,73428.44,2023-06-01,Later any street within sport.
TR0008,AC001,DODIX,sell,29475.28,2023-11-12,Economy check source difficult free study.
TR0009,AC001,DODIX,sell,30185.15,2023-03-29,Yet person old dark item space girl.
TR0010,AC001,DODLX,sell,56398.77,2023-05-23,People yourself ability tend.
TR0011,AC001,DODGX,transfer,97473.0,2024-03-22,Travel surface according network.
TR0012,AC001,DODFX,dividend reinvestment,76679.09,2023-11-19,Report science dream.
TR0013,AC001,DODIX,dividend reinvestment,30918.71,2024-05-29,Teach catch by shoulder.
TR0014,AC001,DODWX,buy,92739.83,2023-11-17,Beautiful certainly state investment on go.
TR0015,AC001,DODWX,sell,52313.29,2023-09-15,Economic include within movie hour.
TR0016,AC001,DODLX,deposit,98387.33,2023-12-26,Position item television guy difficult cover.
TR0017,AC001,DODGX,transfer,78080.44,2023-02-18,Sea become machine.
TR0018,AC001,DODWX,withdrawal,28263.51,2023-05-08,Nearly tonight draw director.
TR0019,AC001,DODWX,sell,40904.64,2023-09-05,Week best economic can matter window.
TR0020,AC001,DODLX,dividend reinvestment,77686.01,2023-10-06,Real force financial fly born card.
TR0021,AC001,DODLX,deposit,93217.19,2024-02-18,Anyone whether bank phone.
TR0022,AC002,DODIX,transfer,62994.77,2023-03-13,Win home commercial president wait staff foot.
TR0023,AC002,DODFX,deposit,98432.97,2024-05-22,True without agent.
TR0024,AC002,DODGX,withdrawal,18879.05,2023-12-02,Suggest share three among laugh institution.
TR0025,AC002,DODLX,buy,13324.0,2023-09-04,Trade small imagine treat.
TR0026,AC002,DODLX,deposit,23349.18,2023-07-25,Win investment across end ready.
TR0027,AC002,DODLX,sell,63382.64,2023-10-31,Tend site blood hot authority.
TR0028,AC002,DODLX,withdrawal,21315.21,2024-02-02,Exactly ground red crime positive source.
TR0029,AC002,DODBX,sell,53414.18,2023-02-09,Already summer tell father wife these option.
TR0030,AC002,DODIX,transfer,75916.61,2023-09-16,Rest where who present happen.
TR0031,AC002,DODGX,buy,1519.23,2023-08-29,Wonder stay decision friend glass.
TR0032,AC002,DODBX,dividend reinvestment,70710.21,2023-08-09,Try likely ten story.
TR0033,AC002,DODIX,transfer,58046.34,2023-11-04,Culture teacher high music expect.
TR0034,AC003,DODLX,deposit,37657.53,2023-06-04,Compare describe rich daughter affect director.
TR0035,AC003,DODWX,sell,42392.7,2023-06-25,Buy daughter wish likely available.
TR0036,AC003,DODIX,sell,97644.26,2023-08-12,Hotel live sure simply reality.
TR0037,AC003,DODFX,withdrawal,4780.59,2023-03-21,Boy sing however sea doctor alone president dream.
TR0038,AC003,DODGX,dividend reinvestment,39512.46,2024-03-03,Number fill almost hand writer strong require.
TR0039,AC003,DODFX,transfer,11108.5,2023-02-23,Role beyond door realize case.
TR0040,AC003,DODBX,deposit,19912.8,2023-09-17,Southern someone still worry my meet.
TR0041,AC003,DODBX,dividend reinvestment,7435.02,2023-07-23,Part any analysis avoid blue.
TR0042,AC003,DODIX,transfer,5459.28,2023-01-26,Old require national energy street call front young.
TR0043,AC003,DODIX,buy,69576.48,2023-12-31,That her ability full heavy threat.
TR0044,AC003,DODWX,buy,86946.55,2023-06-08,Scene technology too establish.
TR0045,AC003,DODGX,sell,42496.77,2023-08-02,Worker police born sister new.
TR0046,AC003,DODIX,sell,98965.98,2024-04-23,Red television prevent.
TR0047,AC003,DODWX,withdrawal,55581.38,2023-07-13,Civil trial brother list key season such.
TR0048,AC003,DODGX,withdrawal,83688.59,2023-03-20,Skin wrong commercial walk focus.
TR0049,AC004,DODWX,dividend reinvestment,96015.6,2024-03-02,Factor lot drop ball table dark particular.
TR0050,AC004,DODBX,dividend reinvestment,38785.49,2023-02-07,Poor as task forward management.
TR0051,AC004,DODIX,transfer,99614.18,2023-11-19,Expert man there sing vote hear.
TR0052,AC004,DODGX,sell,57086.13,2023-05-30,Feeling think thousand with relate.
TR0053,AC004,DODWX,buy,42244.59,2023-04-24,During break country adult total shoulder.
TR0054,AC004,DODGX,deposit,88683.73,2024-03-27,Ready bag few month accept might technology.
TR0055,AC004,DODGX,transfer,2040.95,2023-01-07,Town detail professional two fight.
TR0056,AC004,DODLX,sell,41026.53,2024-01-25,Wonder reveal tree character particular.
TR0057,AC004,DODIX,dividend reinvestment,97441.89,2024-05-22,Million dream receive here number beyond same.
TR0058,AC004,DODFX,dividend reinvestment,87395.75,2023-02-28,Share feeling author any professional step husband page.
TR0059,AC005,DODGX,withdrawal,99127.68,2023-04-26,Television far all wall.
TR0060,AC005,DODIX,sell,97161.39,2024-02-02,Among increase somebody realize tend every agree.
TR0061,AC005,DODGX,transfer,2826.1,2023-01-26,Mrs clearly fast model.
TR0062,AC005,DODWX,transfer,58068.42,2023-03-03,Star find some.
TR0063,AC005,DODGX,transfer,31842.71,2023-11-05,Floor you sure view stuff positive TV free.
TR0064,AC005,DODFX,withdrawal,31470.84,2023-01-28,Father finally quality less.
TR0065,AC005,DODBX,deposit,99906.26,2024-03-01,Blue near leave show land only.
TR0066,AC005,DODFX,deposit,64650.01,2024-01-25,Their rather very develop piece friend hundred.
TR0067,AC005,DODIX,withdrawal,69664.82,2024-01-13,Husband themselves important team imagine agree she late.
TR0068,AC005,DODIX,transfer,60620.54,2023-09-23,Wife business join item space.
TR0069,AC005,DODIX,dividend reinvestment,19194.78,2023-09-11,System pay brother outside loss everyone concern.
TR0070,AC005,DODIX,dividend reinvestment,41546.12,2024-02-04,Performance describe skin forward open goal.
TR0071,AC005,DODIX,dividend reinvestment,48293.01,2024-05-27,Green particular garden matter forget animal black.
TR0072,AC005,DODGX,withdrawal,81950.39,2024-05-25,Board which family various.
TR0073,AC005,DODLX,buy,51816.72,2024-03-07,Plan follow however since note article.
TR0074,AC005,DODGX,withdrawal,70447.52,2023-03-22,Her suddenly recent individual state might Democrat increase.
TR0075,AC005,DODWX,deposit,53140.07,2023-01-29,Director mean box executive it.
TR0076,AC005,DODFX,transfer,63461.4,2023-08-25,Represent together we nearly road and long.
TR0077,AC005,DODBX,sell,67653.31,2023-03-31,Baby manage by street yeah vote important.
TR0078,AC005,DODGX,dividend reinvestment,81244.48,2023-06-28,Four again again college boy.
TR0079,AC005,DODFX,buy,29083.54,2023-02-18,Whether catch young international similar bank.
TR0080,AC005,DODBX,buy,19472.44,2023-12-17,Argue decision special with.
TR0081,AC005,DODIX,withdrawal,35362.53,2023-06-13,Talk hair food sit lead investment.
TR0082,AC005,DODLX,dividend reinvestment,98424.67,2023-07-24,Speech grow here again bring another.
TR0083,AC005,DODLX,sell,68616.52,2023-01-08,Above rich rest seem show trouble.
TR0084,AC005,DODFX,deposit,4313.72,2023-08-27,Glass respond color rule.
TR0085,AC005,DODGX,transfer,98611.83,2024-01-09,Bring interesting speech.
TR0086,AC006,DODLX,deposit,66442.09,2024-04-02,Pay case quickly.
TR0087,AC006,DODFX,transfer,88960.0,2023-06-15,Consumer responsibility better movement right his.
TR0088,AC006,DODLX,dividend reinvestment,645.84,2024-05-02,Both partner candidate production appear.
TR0089,AC006,DODGX,transfer,32809.7,2023-05-28,Whole turn down once bring deep.
TR0090,AC006,DODGX,dividend reinvestment,22311.99,2023-02-25,Ahead none the fine off.
TR0091,AC006,DODGX,withdrawal,50266.07,2023-04-21,Environment process possible.
TR0092,AC006,DODFX,withdrawal,45721.33,2023-03-03,Small pressure end prevent meeting professional he.
TR0093,AC006,DODGX,deposit,17132.52,2023-04-04,Quickly Democrat big try one.
TR0094,AC006,DODFX,withdrawal,59632.14,2024-05-08,Camera nor whose director need particularly page.
TR0095,AC006,DODBX,deposit,59280.61,2024-01-13,Deep black husband attack individual better interesting.
TR0096,AC006,DODGX,sell,70238.48,2023-10-23,Week factor amount bank chance young.
TR0097,AC006,DODBX,transfer,69310.35,2023-12-06,After stage debate bill.
TR0098,AC006,DODBX,deposit,5687.99,2023-10-31,Nor quickly seek your have.
TR0099,AC006,DODIX,withdrawal,72569.83,2023-07-12,Keep work best actually around.
TR0100,AC006,DODLX,buy,6268.51,2023-02-13,War administration sea until suggest agree.
TR0101,AC007,DODFX,buy,24844.91,2024-05-20,Once without action.
TR0102,AC007,DODWX,withdrawal,13060.3,2023-07-20,Program minute every design.
TR0103,AC007,DODLX,buy,33674.32,2023-03-25,Exactly product weight.
TR0104,AC007,DODGX,withdrawal,60092.91,2024-02-09,Even organization agree call this.
TR0105,AC007,DODBX,dividend reinvestment,33337.43,2023-12-25,After happy meet.
TR0106,AC007,DODIX,dividend reinvestment,23809.16,2024-03-25,Specific head anyone.
TR0107,AC008,DODGX,deposit,65059.35,2023-08-22,Under in follow later customer.
TR0108,AC008,DODFX,sell,292.67,2023-04-27,Expert minute stock participant people.
TR0109,AC008,DODFX,deposit,8074.62,2023-01-25,That face sea history board.
TR0110,AC008,DODGX,buy,14843.12,2023-10-06,Case raise let push each father real.
TR0111,AC008,DODFX,buy,32984.54,2023-08-12,Moment third wife central best amount town.
TR0112,AC008,DODBX,transfer,40279.85,2023-07-02,West leg minute table former section thing.
TR0113,AC008,DODGX,transfer,12019.27,2023-12-28,East trial to daughter share fine race west.
TR0114,AC008,DODWX,withdrawal,4690.21,2024-04-05,Power marriage financial program history then.
TR0115,AC008,DODGX,deposit,73768.51,2024-03-12,Above land soon brother reality career while.
TR0116,AC008,DODFX,transfer,72943.23,2023-10-12,Night democratic white eat oil.
TR0117,AC008,DODWX,transfer,72908.44,2023-06-27,Key involve ability generation opportunity wind.
TR0118,AC008,DODIX,deposit,38626.17,2023-10-27,Again spend condition course test deal.
TR0119,AC008,DODWX,sell,83677.41,2023-03-15,Almost score resource save clear certainly.
TR0120,AC008,DODIX,dividend reinvestment,53241.91,2024-04-11,Become identify court either per side teach bring.
TR0121,AC008,DODBX,sell,19038.86,2023-02-26,Family issue amount again year generation watch.
TR0122,AC008,DODIX,dividend reinvestment,95098.82,2023-12-13,Soon tree television agree appear.
TR0123,AC008,DODBX,deposit,93393.98,2023-02-16,Nearly source car fire.
TR0124,AC008,DODIX,deposit,7372.39,2023-03-11,Recent the somebody.
TR0125,AC008,DODWX,deposit,58657.67,2024-03-31,Movie similar bed low car.
TR0126,AC008,DODIX,dividend reinvestment,91003.31,2024-05-28,Budget war also top.
TR0127,AC008,DODGX,dividend reinvestment,69205.63,2023-11-23,Garden trip head food letter sister newspaper apply.
TR0128,AC008,DODGX,dividend reinvestment,61569.96,2023-11-19,Table thousand hospital institution tax item bill movie.
TR0129,AC008,DODWX,buy,5215.09,2023-01-16,Herself become why paper stop drive meeting.
TR0130,AC008,DODFX,buy,22711.13,2023-06-27,Marriage time condition wife structure.
TR0131,AC009,DODFX,withdrawal,60752.54,2023-02-02,Price difference out five.
TR0132,AC009,DODGX,dividend reinvestment,77330.76,2023-07-19,Well dream wife include from.
TR0133,AC009,DODFX,buy,89951.49,2024-02-01,Above black either party.
TR0134,AC009,DODFX,buy,2503.67,2024-03-26,Role country with material land health store.
TR0135,AC009,DODGX,deposit,69529.57,2024-02-15,Congress them gun subject eat course major.
TR0136,AC009,DODLX,sell,77051.53,2024-04-07,Thus business he though meet.
TR0137,AC009,DODIX,withdrawal,11983.82,2023-03-31,Sure station none have attention represent.
TR0138,AC009,DODGX,transfer,19940.32,2023-06-29,Concern official term space half probably.
TR0139,AC009,DODIX,transfer,75004.66,2023-08-22,Blue beat rather again TV see summer.
TR0140,AC009,DODIX,sell,24764.24,2023-02-28,Management wife back energy behind if.
TR0141,AC009,DODWX,buy,63925.75,2023-07-21,Down continue little term necessary too.
TR0142,AC009,DODIX,sell,41030.41,2023-11-18,Manage rich kind bring.
TR0143,AC009,DODGX,sell,95688.74,2023-07-13,Exactly garden reduce cultural head science.
TR0144,AC009,DODIX,withdrawal,48734.88,2023-06-09,Treat center poor mean agreement.
TR0145,AC009,DODFX,deposit,63371.56,2023-04-30,Impact receive outside teach.
TR0146,AC009,DODGX,buy,42085.08,2024-02-09,It system follow.
TR0147,AC009,DODGX,dividend reinvestment,43634.54,2023-10-19,Defense its do claim.
TR0148,AC009,DODBX,deposit,20423.19,2023-02-15,Economic discussion consumer see voice.
TR0149,AC009,DODIX,transfer,97627.31,2023-03-16,Dream yet significant create.
TR0150,AC009,DODFX,transfer,57946.52,2024-02-24,Ability strong right small fill.
TR0151,AC009,DODIX,withdrawal,12328.11,2024-04-20,Lose inside art occur well then week.
TR0152,AC009,DODBX,buy,22275.28,2024-05-29,Paper them for knowledge at.
TR0153,AC009,DODIX,sell,48452.71,2023-04-23,Car herself safe opportunity public maintain.
TR0154,AC009,DODGX,deposit,81002.84,2023-05-15,Also job when feel.
TR0155,AC009,DODWX,dividend reinvestment,69386.63,2023-10-03,Such happen paper religious study billion fear.
TR0156,AC009,DODFX,dividend reinvestment,7159.26,2023-11-14,Great interest use brother detail stand stuff myself.
TR0157,AC010,DODFX,withdrawal,14404.19,2023-08-09,Up Republican land wrong clear could team analysis.
TR0158,AC010,DODGX,dividend reinvestment,31098.36,2023-06-10,Dark art term husband account less.
TR0159,AC010,DODGX,transfer,58574.46,2024-01-12,Along debate however raise course theory baby rate.
TR0160,AC010,DODLX,buy,26477.46,2024-05-13,Give rise guess him.
TR0161,AC010,DODWX,dividend reinvestment,49969.84,2023-08-29,Best however prove.
TR0162,AC010,DODGX,sell,80340.83,2024-04-12,Its themselves everybody page meeting both couple.
TR0163,AC010,DODWX,transfer,8784.91,2023-08-25,Image group second man common enter several life.
TR0164,AC010,DODGX,deposit,21651.41,2024-03-22,City what require.
TR0165,AC010,DODBX,transfer,93358.99,2024-04-18,Dog fear blue.
TR0166,AC010,DODIX,withdrawal,66855.23,2023-05-08,News event product myself accept.
TR0167,AC010,DODBX,deposit,62776.83,2023-06-03,Society identify network daughter agency civil two.
TR0168,AC010,DODFX,deposit,68158.45,2023-12-13,Table machine listen possible glass decide.
TR0169,AC010,DODBX,dividend reinvestment,88933.92,2024-03-02,Similar popular leg current major.
TR0170,AC011,DODIX,deposit,32913.77,2023-12-16,Future doctor quickly short music.
TR0171,AC011,DODWX,deposit,35921.55,2023-11-05,Street rock voice.
TR0172,AC011,DODBX,transfer,96350.51,2024-02-12,Science black religious late decade response.
TR0173,AC011,DODFX,buy,16844.0,2023-01-19,Soon boy strategy somebody since.
TR0174,AC011,DODLX,dividend reinvestment,82564.32,2023-05-03,Raise name task soldier.
TR0175,AC011,DODLX,transfer,98149.8,2023-03-03,That street former.
TR0176,AC011,DODWX,withdrawal,57303.2,2024-02-04,Control work realize treatment government.
TR0177,AC011,DODIX,withdrawal,56180.02,2023-08-04,Exactly during nation.
TR0178,AC011,DODIX,deposit,42822.64,2023-04-17,Several local information quality because full.
TR0179,AC011,DODBX,transfer,76085.58,2023-05-10,Occur from last so.
TR0180,AC011,DODLX,transfer,36813.13,2023-07-21,Call still media teach modern science.
TR0181,AC011,DODWX,deposit,49305.27,2023-02-21,Fly face never notice.
TR0182,AC011,DODGX,transfer,77775.22,2023-02-02,Where speech box pass little simple knowledge.
TR0183,AC011,DODBX,dividend reinvestment,35804.0,2023-03-07,Administration eat civil may.
TR0184,AC011,DODFX,buy,81122.33,2024-03-28,Middle a data issue box.
TR0185,AC011,DODWX,deposit,66488.38,2023-04-01,Man when you member.
TR0186,AC011,DODFX,sell,68881.38,2023-07-30,Wall that wind mother goal forget star.
TR0187,AC011,DODIX,deposit,78308.78,2024-01-25,Local research though fine federal truth option.
TR0188,AC011,DODBX,withdrawal,35874.42,2023-12-07,Offer six color civil.
TR0189,AC011,DODBX,withdrawal,27121.09,2024-02-15,Statement increase against seem least.
TR0190,AC011,DODWX,sell,79980.35,2024-03-02,Finally red upon billion.
TR0191,AC011,DODBX,transfer,14552.02,2023-10-09,Single simple skin seek itself range than.
TR0192,AC011,DODWX,sell,85297.75,2024-01-04,Suggest each like place marriage know cold say.
TR0193,AC012,DODWX,dividend reinvestment,738.19,2023-03-25,Live security always yeah dinner.
TR0194,AC012,DODIX,deposit,96606.52,2024-05-13,Just already subject summer.
TR0195,AC012,DODBX,buy,11703.92,2023-12-06,Reality man low quickly work most condition.
TR0196,AC012,DODIX,dividend reinvestment,87130.93,2023-04-06,Second their car evidence receive for then.
TR0197,AC012,DODIX,sell,68668.01,2023-09-25,Have chance kid civil represent special sell.
TR0198,AC012,DODFX,buy,31049.61,2023-06-02,Herself sound clearly evidence meeting.
TR0199,AC012,DODFX,buy,24391.44,2024-04-26,Hope red may key build sure.
TR0200,AC012,DODGX,dividend reinvestment,17064.22,2023-09-23,Whom page actually tree before turn should.
TR0201,AC012,DODBX,withdrawal,97872.32,2024-04-11,Measure approach day.
TR0202,AC012,DODGX,buy,21867.22,2023-08-07,Wait south into other computer live.
TR0203,AC012,DODBX,transfer,5573.07,2023-09-10,Section style laugh financial your.
TR0204,AC012,DODLX,deposit,74530.93,2023-12-13,Report partner fine.
TR0205,AC012,DODWX,dividend reinvestment,80243.45,2023-12-31,Keep position owner wait.
TR0206,AC012,DODFX,withdrawal,19410.69,2023-10-08,Who summer senior night.
TR0207,AC012,DODLX,sell,91360.71,2023-05-10,Well small large expect be direction.
TR0208,AC012,DODIX,withdrawal,58596.27,2023-09-30,Down what allow road event heavy.
TR0209,AC012,DODWX,transfer,91920.14,2023-06-29,Movement sense ahead class.
TR0210,AC012,DODBX,transfer,13701.43,2023-01-09,Radio great behavior chair book.
TR0211,AC012,DODGX,transfer,71759.41,2023-11-07,Add movie real.
TR0212,AC012,DODBX,dividend reinvestment,82989.28,2024-04-25,Interview hour act officer.
TR0213,AC012,DODWX,transfer,37417.72,2023-02-21,Very lot drive heart father case ten student.
TR0214,AC012,DODFX,sell,72988.58,2023-07-15,Administration his resource.
TR0215,AC012,DODGX,withdrawal,75915.75,2023-07-05,Interesting loss room really on.
TR0216,AC012,DODLX,dividend reinvestment,9134.1,2024-02-15,Political environmental owner catch.
TR0217,AC012,DODBX,sell,13871.74,2024-01-14,Growth bit card record under read relate table.
TR0218,AC012,DODIX,buy,3351.56,2023-01-15,About treatment live student.
TR0219,AC012,DODBX,sell,7926.13,2023-05-14,Side themselves information pretty.
TR0220,AC012,DODIX,transfer,54208.0,2023-03-13,Sometimes measure room family.
TR0221,AC012,DODIX,dividend reinvestment,59389.94,2024-05-21,Have reflect health direction standard financial movie.
TR0222,AC012,DODWX,buy,41607.93,2024-05-04,Radio image statement.
TR0223,AC013,DODIX,transfer,70330.85,2023-07-26,Increase dinner number value outside.
TR0224,AC013,DODWX,sell,73059.08,2023-09-10,Thought subject general threat argue.
TR0225,AC013,DODGX,withdrawal,84990.89,2023-02-15,Table enjoy color response.
TR0226,AC013,DODBX,transfer,70762.66,2024-03-24,Medical market move south sound inside.
TR0227,AC013,DODGX,withdrawal,10230.92,2023-01-20,Hit financial feel represent maintain sort.
TR0228,AC013,DODIX,withdrawal,16411.29,2023-07-17,Though leave modern significant star land church him.
TR0229,AC013,DODIX,dividend reinvestment,61607.54,2023-03-16,Possible collection kitchen book.
TR0230,AC013,DODIX,dividend reinvestment,12514.88,2023-12-09,Somebody perform matter now buy language.
TR0231,AC013,DODFX,deposit,88591.39,2023-01-18,Forget strategy near entire require also.
TR0232,AC013,DODGX,dividend reinvestment,19607.39,2024-01-13,Top day argue training.
TR0233,AC013,DODGX,buy,6474.44,2024-02-13,Join food teach whether let across.
TR0234,AC013,DODFX,deposit,12560.91,2023-05-27,Grow throughout head few.
TR0235,AC013,DODGX,withdrawal,66851.18,2023-11-02,Series himself house trial business experience.
TR0236,AC013,DODBX,withdrawal,31874.12,2024-02-07,Red meet bring win.
TR0237,AC013,DODWX,transfer,96115.28,2023-05-05,Candidate those need determine performance.
TR0238,AC014,DODGX,sell,98367.54,2023-08-17,Bag operation door new cultural.
TR0239,AC014,DODFX,withdrawal,50422.46,2023-05-05,Reveal support garden part sing agency bit.
TR0240,AC014,DODIX,buy,27071.31,2023-02-24,Development do themselves wrong attorney property if.
TR0241,AC014,DODFX,buy,14079.22,2023-03-07,Something of environment instead.
TR0242,AC014,DODLX,buy,72755.94,2023-09-15,Offer he we world time full measure.
TR0243,AC014,DODBX,sell,88961.81,2023-08-13,Red teach me wonder happy.
TR0244,AC014,DODIX,sell,47009.31,2023-09-24,Allow cell stop should also.
TR0245,AC014,DODWX,sell,11393.35,2023-06-27,Deal dog some record describe.
TR0246,AC014,DODBX,buy,3880.35,2023-04-06,Read have hold enough light.
TR0247,AC014,DODLX,dividend reinvestment,37473.35,2023-02-17,Turn rise employee small.
TR0248,AC014,DODWX,deposit,5387.39,2023-06-15,Turn result purpose.
TR0249,AC014,DODBX,transfer,12549.59,2023-05-22,Eat song book save.
TR0250,AC014,DODGX,dividend reinvestment,58179.92,2023-05-18,Bit market month month.
TR0251,AC014,DODLX,buy,16875.76,2023-04-03,Third difficult building condition animal themselves about.
TR0252,AC014,DODBX,transfer,43891.99,2024-02-23,Miss leave hot but.
TR0253,AC014,DODBX,sell,96918.44,2023-12-04,When answer reduce require business.
TR0254,AC014,DODWX,transfer,12640.69,2023-04-03,Car feel push really program world.
TR0255,AC014,DODLX,sell,51926.55,2023-08-12,Strategy project present person.
TR0256,AC014,DODLX,withdrawal,85214.39,2023-06-08,Large customer official.
TR0257,AC014,DODGX,withdrawal,55272.11,2023-01-20,Cold north off bill.
TR0258,AC015,DODFX,deposit,36659.88,2023-09-05,Minute you better.
TR0259,AC015,DODLX,buy,93509.62,2023-12-25,Reduce dinner good work.
TR0260,AC015,DODWX,withdrawal,6294.2,2023-02-08,Others tough public election me goal.
TR0261,AC015,DODLX,withdrawal,594.93,2023-09-19,Carry most more no loss record responsibility center.
TR0262,AC015,DODWX,sell,87200.03,2024-02-14,Rather decade argue leave source.
TR0263,AC015,DODWX,withdrawal,68381.78,2023-10-07,Appear nice forward knowledge travel.
TR0264,AC015,DODFX,withdrawal,11517.56,2023-04-09,Foreign computer north office into any radio rate.
TR0265,AC015,DODBX,transfer,8917.85,2023-03-15,Table east either detail cup page might.
TR0266,AC015,DODBX,dividend reinvestment,30719.74,2023-06-20,Kitchen third modern hard think get.
TR0267,AC015,DODLX,deposit,23743.12,2023-02-19,Across TV might front exactly field major.
TR0268,AC015,DODFX,dividend reinvestment,15053.64,2023-05-01,Whether next water receive.
TR0269,AC015,DODBX,sell,29995.26,2024-01-29,Center movement personal agent.
TR0270,AC015,DODBX,buy,55146.07,2024-05-12,Compare bed see rise under.
TR0271,AC015,DODFX,sell,28314.64,2023-11-12,Effort every movie tough us guess level.
TR0272,AC015,DODIX,withdrawal,18219.79,2024-04-10,Yet food brother hear.
TR0273,AC015,DODWX,dividend reinvestment,26250.52,2024-01-26,Kid pick heart share national perform.
TR0274,AC015,DODLX,dividend reinvestment,96757.3,2024-04-20,While discuss sing red them.
TR0275,AC015,DODGX,sell,5466.23,2023-12-02,Ball life seat probably why sea cut.
TR0276,AC015,DODWX,deposit,24534.36,2024-01-24,Trade two member cause involve once.
TR0277,AC015,DODBX,dividend reinvestment,88096.07,2023-07-21,Will yet key election development teach though Republican.
TR0278,AC015,DODIX,transfer,56142.07,2023-10-18,High change account why improve science.
TR0279,AC015,DODFX,transfer,40302.68,2023-02-25,Focus camera notice body staff anyone ago.
TR0280,AC015,DODBX,transfer,34898.4,2023-06-26,Wall bring the industry.
TR0281,AC015,DODGX,withdrawal,58102.84,2023-03-29,Present black firm hope thousand pretty she cause.
TR0282,AC015,DODFX,sell,84117.76,2023-05-07,Almost officer call treatment operation key.
TR0283,AC015,DODWX,deposit,24069.53,2023-07-06,Address up finish voice.
TR0284,AC015,DODLX,dividend reinvestment,26782.48,2023-06-20,Forward would affect military boy.
TR0285,AC016,DODGX,withdrawal,55105.58,2023-09-05,Wait subject for special resource open wind.
TR0286,AC016,DODIX,deposit,82814.07,2023-09-29,Set light then also.
TR0287,AC016,DODLX,transfer,43290.33,2023-03-16,Lot include again allow.
TR0288,AC016,DODFX,buy,17197.22,2023-04-20,Over as enter political.
TR0289,AC016,DODIX,sell,49749.27,2023-02-02,Consumer tell join nor along.
TR0290,AC016,DODLX,transfer,96013.97,2023-08-14,Service actually work send phone above until wide.
TR0291,AC016,DODFX,buy,44244.18,2023-04-03,Three moment least protect front against.
TR0292,AC017,DODWX,withdrawal,86150.84,2023-04-03,Role star before wind.
TR0293,AC017,DODWX,transfer,95900.28,2023-06-26,Fine agency art culture.
TR0294,AC017,DODLX,buy,51450.11,2023-03-03,Even drop but office budget read others.
TR0295,AC017,DODBX,buy,18515.2,2024-05-22,Drive hold red example trial.
TR0296,AC017,DODWX,transfer,18303.41,2024-01-19,Investment foreign game pressure goal.
TR0297,AC017,DODLX,deposit,10296.4,2023-02-02,Compare clear reason training.
TR0298,AC018,DODGX,deposit,77618.9,2024-01-09,Federal point tree real view rock.
TR0299,AC018,DODIX,sell,31624.55,2023-08-10,Hope give art between travel half.
TR0300,AC018,DODBX,dividend reinvestment,59023.9,2024-05-14,Successful possible help generation ten imagine.
TR0301,AC018,DODIX,withdrawal,75796.67,2024-01-13,Board at not lot myself.
TR0302,AC018,DODGX,sell,3255.54,2023-09-12,Share woman wind special alone.
