TransactionID,AccountID,FundID,TransactionType,Amount,TransactionDate,Notes
TR0603,AC037,DODFX,withdrawal,23369.19,2024-02-13,Mention certain board customer fly right.
TR0604,AC037,DODFX,buy,79179.9,2023-05-18,Picture product ball adult today keep resource.
TR0605,AC037,DODGX,dividend reinvestment,33911.43,2024-02-20,Never bit hair alone agree enjoy Republican but.
TR0606,AC037,DODBX,sell,4708.14,2023-07-15,Mention marriage hundred side gas them experience.
TR0607,AC037,DODFX,deposit,66540.97,2023-12-08,Discussion president network include success similar.
TR0608,AC037,DODBX,withdrawal,70224.08,2023-06-26,Yeah yard member enter possible mother affect.
TR0609,AC037,DODLX,withdrawal,51575.61,2024-02-02,Various notice theory only area science.
TR0610,AC037,DODBX,withdrawal,15456.21,2023-07-18,Daughter answer best six fact weight.
TR0611,AC037,DODWX,buy,54040.15,2024-03-17,Eight lead pressure.
TR0612,AC037,DODWX,sell,99530.76,2023-02-08,Bit shoulder room fall area will test.
TR0613,AC037,DODBX,dividend reinvestment,91019.38,2024-04-21,Alone develop job anything page really official.
TR0614,AC037,DODIX,withdrawal,73659.9,2023-08-10,Four dream art page.
TR0615,AC038,DODIX,deposit,98906.03,2023-11-01,Write test floor rock end find simple.
TR0616,AC038,DODLX,deposit,96657.25,2023-07-22,All reach wait region.
TR0617,AC038,DODLX,withdrawal,60703.82,2023-03-23,Air which ago could.
TR0618,AC038,DODIX,deposit,41596.47,2023-08-27,Truth part another administration less American.
TR0619,AC038,DODLX,buy,24998.74,2023-11-19,Next rule rest myself.
TR0620,AC038,DODFX,buy,68044.18,2023-12-31,Sign speak force camera town tough.
TR0621,AC038,DODFX,buy,61961.63,2023-03-14,Information practice spring.
TR0622,AC038,DODWX,deposit,71441.26,2023-03-12,Own box should have cell.
TR0623,AC038,DODWX,transfer,93696.26,2024-01-12,Difficult charge benefit hope wish.
TR0624,AC038,DODLX,sell,80950.64,2023-05-22,Trial evening issue her something put let red.
TR0625,AC038,DODIX,dividend reinvestment,16916.19,2023-10-29,Strategy common seek represent and.
TR0626,AC038,DODBX,withdrawal,88994.4,2023-08-06,Analysis major mind something husband.
TR0627,AC038,DODIX,buy,11969.27,2023-03-01,Listen care certain control task language try what.
TR0628,AC039,DODFX,withdrawal,56622.95,2023-06-30,Age chair what course even.
TR0629,AC039,DODGX,deposit,72931.47,2023-08-08,Entire shake suddenly soldier process.
TR0630,AC039,DODGX,deposit,17058.4,2023-02-10,Remain can dinner sell.
TR0631,AC039,DODBX,buy,97426.25,2024-02-10,Require help type least forward exist.
TR0632,AC039,DODLX,withdrawal,83797.96,2023-04-21,Her site response beyond six month series.
TR0633,AC039,DODIX,deposit,19301.2,2024-02-28,Information program big coach do enjoy during.
TR0634,AC039,DODBX,withdrawal,19575.78,2023-11-24,Month agreement let factor.
TR0635,AC039,DODGX,buy,95591.91,2024-04-03,Artist success party money allow.
TR0636,AC039,DODLX,buy,3694.03,2023-11-30,Store unit image arrive meeting.
TR0637,AC040,DODGX,buy,61844.77,2023-10-01,Early tough today simply.
TR0638,AC040,DODWX,buy,31152.71,2024-05-14,Difficult above interesting involve pattern be.
TR0639,AC040,DODGX,dividend reinvestment,88188.02,2023-02-03,Usually white early candidate.
TR0640,AC040,DODGX,dividend reinvestment,45333.63,2024-02-28,Already else worry fire with city father.
TR0641,AC040,DODLX,buy,17708.83,2023-08-09,Executive try grow television threat region action.
TR0642,AC040,DODBX,deposit,2543.26,2023-03-28,And some sign remain.
TR0643,AC040,DODLX,buy,75778.91,2024-05-18,Night attack soon economy.
TR0644,AC040,DODBX,buy,91228.7,2023-10-29,Community each while role local rest.
TR0645,AC040,DODLX,sell,33687.22,2023-08-16,Light without quite author arm pay soldier.
TR0646,AC040,DODGX,withdrawal,42722.96,2023-05-10,Different federal person toward until.
TR0647,AC040,DODGX,withdrawal,70329.21,2024-01-17,Fill I employee girl cup ready government.
TR0648,AC040,DODLX,buy,85082.6,2024-05-05,Whose member garden article.
TR0649,AC040,DODIX,buy,67287.41,2023-04-20,Along believe leader give.
TR0650,AC040,DODBX,transfer,37642.8,2023-04-26,Improve court six.
TR0651,AC040,DODGX,withdrawal,33678.58,2023-05-31,Store on expert contain and few pressure.
TR0652,AC040,DODBX,withdrawal,66133.28,2024-04-20,Team some kid.
TR0653,AC040,DODLX,buy,98694.22,2023-09-24,Thank someone after avoid.
TR0654,AC040,DODIX,sell,10888.17,2023-02-09,Five maybe attack might worry somebody war.
TR0655,AC040,DODLX,buy,89824.42,2023-10-30,Song sign these ready foreign our three wait.
TR0656,AC040,DODBX,withdrawal,76114.27,2023-09-29,Miss participant significant year statement role themselves.
TR0657,AC041,DODIX,withdrawal,15899.51,2023-09-22,Sit citizen product phone identify television.
TR0658,AC041,DODLX,deposit,24896.09,2023-09-12,Reason feeling person act order.
TR0659,AC041,DODIX,dividend reinvestment,41174.97,2023-06-19,His use street myself value dark catch.
TR0660,AC041,DODIX,sell,17549.47,2024-05-23,Similar important large home road.
TR0661,AC041,DODWX,deposit,94779.03,2023-10-03,Have bag style particular.
TR0662,AC041,DODIX,buy,43864.41,2024-04-15,Large administration mean position bit common both challenge.
TR0663,AC041,DODBX,deposit,41643.46,2023-08-16,Wall machine hold dog million successful this.
TR0664,AC041,DODIX,transfer,48509.52,2023-01-12,Identify writer whole government according the property watch.
TR0665,AC042,DODFX,dividend reinvestment,58728.43,2023-02-07,Feeling hair left treatment fund.
TR0666,AC042,DODFX,dividend reinvestment,89948.49,2023-08-15,Top better base truth.
TR0667,AC042,DODFX,buy,15316.24,2023-10-06,Democrat forward miss whose.
TR0668,AC042,DODGX,withdrawal,63678.76,2023-06-03,Standard rest institution less.
TR0669,AC042,DODGX,withdrawal,24731.6,2023-08-15,Quickly capital military.
TR0670,AC042,DODGX,deposit,44804.03,2024-01-05,Eight event last particular.
TR0671,AC042,DODGX,transfer,11227.43,2024-03-21,Usually very level.
TR0672,AC042,DODBX,withdrawal,51204.2,2023-01-24,Both exactly door offer finish trial nice.
TR0673,AC042,DODBX,deposit,58057.58,2024-01-18,Available future specific.
TR0674,AC042,DODIX,transfer,1354.45,2023-01-20,Pass toward table point bed do.
TR0675,AC042,DODIX,transfer,2323.63,2023-04-10,Building win ten sister hair remember break.
TR0676,AC042,DODBX,transfer,97910.48,2023-02-03,Thing fight machine more anything.
TR0677,AC042,DODFX,dividend reinvestment,9965.05,2023-09-15,How reveal compare open order.
TR0678,AC042,DODWX,dividend reinvestment,70437.41,2023-12-18,Protect left difficult.
TR0679,AC042,DODWX,deposit,21445.15,2023-06-08,Able inside the gun report for.
TR0680,AC042,DODWX,transfer,74935.61,2023-07-23,Return as myself test reveal.
TR0681,AC042,DODFX,sell,84930.47,2024-04-30,Shake success available between.
TR0682,AC042,DODLX,withdrawal,18269.21,2024-04-20,Until particular exactly old.
TR0683,AC042,DODGX,transfer,99285.21,2024-02-14,Soldier member experience you.
TR0684,AC042,DODBX,sell,39682.39,2024-05-10,Purpose hundred show car fund number.
TR0685,AC042,DODWX,deposit,51925.25,2023-06-28,Age town behavior four fight bit.
TR0686,AC043,DODLX,buy,26079.47,2023-03-26,Any arm type American option perform happen.
TR0687,AC043,DODGX,buy,19512.67,2023-08-29,Big produce officer good.
TR0688,AC043,DODWX,buy,95243.56,2023-09-29,Issue city set senior not order source.
TR0689,AC043,DODLX,transfer,56500.97,2023-01-27,Stand fund dream discuss.
TR0690,AC043,DODFX,deposit,40480.61,2023-08-31,Keep almost later they evening.
TR0691,AC043,DODGX,deposit,33351.36,2023-02-21,Deep other rest tonight role while.
TR0692,AC043,DODFX,transfer,72894.53,2024-02-07,Movie off top real full response maybe science.
TR0693,AC043,DODWX,sell,4110.01,2023-03-24,Conference view production central public.
TR0694,AC043,DODBX,buy,28154.27,2023-03-12,Less these environmental one enter.
TR0695,AC043,DODGX,sell,2819.33,2024-04-21,Project responsibility across stop nor recognize.
TR0696,AC043,DODFX,buy,70118.58,2023-03-29,Statement at let see tree.
TR0697,AC043,DODFX,withdrawal,46312.18,2023-05-10,Economic speech perform between available.
TR0698,AC043,DODLX,deposit,82560.98,2023-10-17,Expert trial type left amount.
TR0699,AC043,DODLX,transfer,76946.31,2023-03-04,Could administration news identify.
TR0700,AC043,DODBX,transfer,73045.92,2023-01-14,Before hour none kitchen.
TR0701,AC043,DODIX,transfer,71473.27,2023-12-11,Seek government material account garden exist memory international.
TR0702,AC043,DODGX,transfer,54490.04,2023-04-15,Thousand heart smile business soldier.
TR0703,AC043,DODBX,buy,60867.58,2023-09-24,Phone health stop stuff address fine together.
TR0704,AC043,DODWX,sell,46189.95,2023-03-29,Dinner thank discover bank first to.
TR0705,AC043,DODGX,dividend reinvestment,5356.29,2024-03-19,Toward gun air federal Congress.
TR0706,AC043,DODIX,sell,18108.49,2023-09-30,Share social another buy left dream future security.
TR0707,AC043,DODWX,transfer,84256.82,2023-04-06,Thus rate traditional note always.
TR0708,AC044,DODGX,transfer,18153.97,2024-05-10,New forget meet.
TR0709,AC044,DODIX,deposit,37114.13,2023-03-09,Head school by arm know.
TR0710,AC044,DODIX,dividend reinvestment,40365.95,2023-12-08,Debate five night.
TR0711,AC044,DODWX,buy,80235.74,2023-01-19,Put woman may read.
TR0712,AC044,DODFX,buy,58258.86,2023-11-25,Coach rate several tough must memory college.
TR0713,AC044,DODFX,sell,61718.13,2023-07-17,Current explain before total thus score practice.
TR0714,AC044,DODIX,withdrawal,58753.95,2023-01-21,Finally outside top us choice themselves.
TR0715,AC044,DODLX,sell,82315.29,2023-09-27,Popular fine artist Congress remember everyone subject loss.
TR0716,AC044,DODFX,sell,28968.96,2023-12-22,Might realize detail no safe candidate.
TR0717,AC044,DODWX,buy,12675.02,2024-05-29,Exist pick far whom speak everybody involve.
TR0718,AC044,DODLX,withdrawal,17784.02,2024-04-04,Throughout like story about walk central represent.
TR0719,AC044,DODWX,transfer,6071.14,2023-10-23,Already likely people economy.
TR0720,AC044,DODGX,sell,94449.02,2023-10-22,Make say process tell.
TR0721,AC044,DODWX,dividend reinvestment,97898.76,2023-11-17,Point east story audience arrive.
TR0722,AC044,DODGX,sell,39921.66,2023-11-24,Benefit necessary final whole director bar after itself.
TR0723,AC044,DODGX,withdrawal,89912.56,2023-10-30,Computer resource clearly role win beat moment.
TR0724,AC044,DODFX,transfer,31829.74,2023-02-17,Least some onto each government reduce religious.
TR0725,AC044,DODWX,buy,60064.03,2023-08-09,Task hear effect edge close.
TR0726,AC044,DODBX,transfer,27561.2,2023-04-09,Paper around too get who PM hard.
TR0727,AC044,DODLX,sell,58983.86,2023-04-08,Name professional join fact nation serious.
TR0728,AC045,DODBX,buy,5253.67,2023-07-09,Hot challenge shake night national class light.
TR0729,AC045,DODLX,dividend reinvestment,93288.08,2023-06-05,Picture vote join focus including.
TR0730,AC045,DODGX,transfer,59725.5,2023-01-10,Local most visit though article notice early.
TR0731,AC045,DODFX,withdrawal,80273.13,2024-04-26,Team against game.
TR0732,AC045,DODLX,sell,28540.36,2023-09-16,Important official black out civil woman.
TR0733,AC045,DODFX,deposit,58013.94,2023-01-28,Well Democrat maintain prepare standard citizen indicate.
TR0734,AC045,DODGX,dividend reinvestment,25954.38,2024-05-28,Those suggest between mind safe particular.
TR0735,AC045,DODWX,sell,49582.94,2023-12-19,Hand give ground have member consumer.
TR0736,AC045,DODGX,sell,15148.73,2024-05-09,Government recently protect range approach.
TR0737,AC045,DODGX,buy,8659.46,2023-08-07,Sister grow grow consider.
TR0738,AC045,DODFX,sell,94338.57,2023-05-14,With theory wind feeling can.
TR0739,AC045,DODFX,transfer,23442.41,2024-01-17,Nor music commercial huge news.
TR0740,AC045,DODLX,buy,3661.84,2024-04-12,Authority major upon ask performance economic commercial day.
TR0741,AC045,DODFX,sell,75368.26,2023-05-15,Door law so smile fact.
TR0742,AC045,DODIX,buy,23645.94,2024-03-01,Coach people never benefit.
TR0743,AC045,DODFX,transfer,26298.53,2024-04-10,Store of company among in yard lead.
TR0744,AC045,DODIX,buy,98117.66,2024-02-21,Brother responsibility she adult sister.
TR0745,AC045,DODIX,dividend reinvestment,14571.41,2023-10-30,We manager organization significant price production inside.
TR0746,AC045,DODFX,buy,53904.97,2024-05-14,Lose lead peace discussion civil collection challenge.
TR0747,AC045,DODIX,withdrawal,40901.19,2024-01-30,Society Congress employee yeah trial company happen.
TR0748,AC045,DODIX,sell,47512.11,2023-03-11,Upon environment truth card effect political.
TR0749,AC045,DODIX,buy,69749.99,2024-04-15,Visit fund cell prevent want.
TR0750,AC045,DODIX,sell,4738.62,2024-01-10,Force husband hit activity address south pass.
TR0751,AC045,DODGX,transfer,18393.34,2024-01-29,Seem thousand upon watch discussion.
TR0752,AC045,DODIX,transfer,56553.64,2023-12-12,Her trade authority would husband fine radio.
TR0753,AC045,DODWX,withdrawal,51632.81,2024-04-23,Prove participant boy president campaign.
TR0754,AC045,DODGX,buy,58407.07,2023-08-29,Result bed create somebody us.
TR0755,AC045,DODGX,transfer,8785.11,2024-02-04,Increase where election avoid.
TR0756,AC045,DODWX,deposit,5226.78,2023-08-05,Land staff boy quickly plant tonight science.
TR0757,AC046,DODIX,sell,75896.3,2023-12-03,Contain half technology program.
TR0758,AC046,DODIX,deposit,10574.38,2023-10-31,Top cover talk hard style at all board.
TR0759,AC046,DODGX,deposit,50000.48,2023-03-19,Same audience serve wish dark country.
TR0760,AC046,DODGX,buy,43144.12,2024-02-28,Want really and tend someone suggest raise.
TR0761,AC046,DODWX,withdrawal,17193.46,2023-01-24,Production final any shoulder.
TR0762,AC046,DODBX,buy,69862.24,2023-05-04,Check bring here.
TR0763,AC046,DODBX,deposit,4893.76,2024-03-13,Rich affect drive send education partner.
TR0764,AC046,DODIX,sell,13589.19,2024-04-01,Its forward performance coach seek red.
TR0765,AC046,DODGX,transfer,2250.62,2023-12-05,Page technology under another.
TR0766,AC046,DODIX,deposit,45911.32,2023-01-01,Rich population late suddenly.
TR0767,AC046,DODWX,transfer,988.3,2024-02-15,I yourself red control.
TR0768,AC046,DODLX,dividend reinvestment,34300.15,2024-01-23,Activity tend movie.
TR0769,AC046,DODIX,dividend reinvestment,75014.46,2023-10-08,Position quite experience remember term check response although.
TR0770,AC046,DODBX,deposit,11818.89,2023-10-20,Film economic significant.
TR0771,AC047,DODLX,transfer,8228.74,2023-06-18,Mrs major experience.
TR0772,AC047,DODBX,deposit,53427.53,2024-01-13,Employee three kitchen any minute fear determine.
TR0773,AC047,DODLX,withdrawal,25774.96,2023-05-07,Head blood interest prepare discussion.
TR0774,AC047,DODIX,withdrawal,89596.55,2023-08-24,Find member ground bring theory describe general.
TR0775,AC047,DODBX,dividend reinvestment,57070.49,2024-04-28,Know knowledge month care kind.
TR0776,AC047,DODWX,dividend reinvestment,75812.52,2023-03-07,Drug argue question and my something others.
TR0777,AC047,DODGX,buy,86980.64,2023-05-18,Thought meeting name know maybe return everybody.
TR0778,AC047,DODFX,sell,13412.38,2023-05-06,Total establish record generation factor same.
TR0779,AC048,DODWX,buy,56737.32,2023-02-07,Special various risk idea physical.
TR0780,AC048,DODIX,buy,83555.27,2023-08-02,Shake mission issue pretty.
TR0781,AC048,DODWX,deposit,77101.58,2023-11-29,Wide cover party room along history.
TR0782,AC048,DODBX,deposit,39529.02,2023-10-08,Need strategy ability world.
TR0783,AC048,DODIX,withdrawal,80056.91,2023-05-31,Test between foot six fire usually.
TR0784,AC048,DODWX,transfer,10890.66,2024-02-02,Whether small system organization decide ok.
TR0785,AC048,DODIX,sell,42535.11,2023-11-14,One nation later let bed save.
TR0786,AC048,DODWX,deposit,94897.4,2024-03-08,The note more nice.
TR0787,AC048,DODBX,dividend reinvestment,48774.29,2023-08-18,Activity month page produce can into often huge.
TR0788,AC048,DODFX,transfer,22681.24,2023-06-07,Mouth interview behavior picture start eat.
TR0789,AC048,DODFX,withdrawal,22118.15,2023-07-18,Vote fast sometimes beyond now next.
TR0790,AC048,DODIX,buy,13562.65,2023-02-26,Yard door agreement since card campaign maybe.
TR0791,AC048,DODWX,withdrawal,13788.16,2023-07-08,Employee unit west company.
TR0792,AC048,DODGX,deposit,86468.89,2023-10-05,Child media century.
TR0793,AC048,DODBX,deposit,76775.01,2024-04-19,Mouth question best into those middle owner wait.
TR0794,AC048,DODBX,buy,4314.97,2023-04-30,Citizen grow stay it the traditional top.
TR0795,AC048,DODIX,transfer,7542.68,2023-08-30,Fund continue explain keep reality politics middle artist.
TR0796,AC048,DODWX,withdrawal,39169.81,2023-04-21,Article author media process watch many.
TR0797,AC048,DODFX,sell,84328.92,2023-10-16,Evidence probably support place difference.
TR0798,AC048,DODLX,deposit,97601.02,2023-09-27,Training central cover director they.
TR0799,AC048,DODFX,transfer,99443.33,2024-01-05,Bed appear daughter rock.
TR0800,AC048,DODBX,deposit,99724.59,2024-01-28,Use still participant stand sense.
TR0801,AC048,DODWX,sell,60686.19,2024-03-22,Arm Mrs us discuss reach every.
TR0802,AC048,DODIX,deposit,2633.04,2024-02-25,Player song sort authority challenge.
TR0803,AC048,DODGX,buy,87442.04,2023-01-08,Right thus every allow concern court interest fact.
TR0804,AC048,DODBX,sell,87794.93,2023-05-15,One husband main yeah one company.
TR0805,AC048,DODFX,withdrawal,43167.83,2023-05-28,Do education wrong school sure action person.
TR0806,AC048,DODBX,withdrawal,22086.79,2023-01-08,Case finish seat technology or much price.
TR0807,AC048,DODGX,withdrawal,20179.59,2023-07-08,Value realize option.
TR0808,AC049,DODWX,buy,43405.03,2024-01-07,Government condition up he.
TR0809,AC049,DODIX,withdrawal,21543.55,2024-03-11,Actually above miss politics spend.
TR0810,AC049,DODGX,sell,37903.74,2024-04-04,Player hard majority forget line month lawyer bit.
TR0811,AC049,DODBX,transfer,12214.95,2023-02-08,Explain American record book.
TR0812,AC049,DODWX,deposit,24793.33,2023-10-30,Fund and seat accept wish.
TR0813,AC049,DODWX,withdrawal,83386.07,2024-05-26,Vote yet most try industry tend.
TR0814,AC049,DODGX,buy,45528.5,2024-01-11,Power bill red tonight a.
TR0815,AC049,DODBX,withdrawal,7915.91,2024-03-29,East decade exist section difference.
TR0816,AC049,DODIX,dividend reinvestment,7260.67,2023-05-14,All suffer imagine deal focus.
TR0817,AC049,DODIX,withdrawal,57718.34,2023-11-10,Care discover those.
TR0818,AC049,DODIX,deposit,25993.38,2023-03-16,Site its least night popular capital collection bed.
TR0819,AC049,DODLX,sell,29191.08,2023-08-02,Organization make first contain another space imagine.
TR0820,AC049,DODWX,buy,48310.08,2023-01-27,Believe view board four training.
TR0821,AC049,DODGX,transfer,85269.83,2023-03-14,Blood site marriage blue.
TR0822,AC049,DODFX,transfer,24781.45,2023-07-20,Sure moment own political there.
TR0823,AC049,DODIX,dividend reinvestment,91980.42,2024-04-26,Participant southern despite music trade share mean.
TR0824,AC050,DODGX,withdrawal,91328.97,2023-12-23,Respond as skill once.
TR0825,AC050,DODFX,withdrawal,35149.02,2023-08-17,Into group student open before represent become.
TR0826,AC050,DODIX,buy,19407.68,2024-01-05,Sell eat seek key air.
TR0827,AC050,DODFX,withdrawal,30527.29,2023-09-17,Think provide capital.
TR0828,AC050,DODLX,deposit,51186.8,2024-04-24,Fish prevent game wish soldier want property.
TR0829,AC050,DODWX,transfer,19691.67,2024-05-06,Long across source model century.
TR0830,AC050,DODWX,deposit,27050.24,2024-05-22,Local defense sort will general fly until your.
TR0831,AC050,DODWX,sell,52122.96,2024-03-03,Act thousand support out front meet none.
TR0832,AC050,DODGX,transfer,88046.76,2023-01-20,Sound investment cultural treatment establish.
TR0833,AC050,DODFX,buy,74781.7,2023-07-06,Over race cultural.
TR0834,AC051,DODLX,withdrawal,99916.03,2023-08-28,Upon run might adult information tax.
TR0835,AC051,DODIX,sell,53694.53,2023-08-31,Necessary toward stay until.
TR0836,AC051,DODIX,deposit,52333.4,2023-11-26,Study law bar.
TR0837,AC051,DODFX,dividend reinvestment,65201.01,2023-10-30,Wide everybody current computer life.
TR0838,AC051,DODLX,transfer,1776.97,2023-09-14,Me woman serve.
TR0839,AC051,DODFX,deposit,42995.18,2023-12-11,Door fear bring woman gas program.
TR0840,AC051,DODIX,sell,22988.49,2024-02-08,Road focus PM.
TR0841,AC051,DODBX,deposit,26770.52,2023-10-10,Hundred spring listen candidate suggest control determine.
TR0842,AC051,DODBX,sell,21507.43,2023-07-09,Simply technology wall practice deep total high.
TR0843,AC051,DODWX,withdrawal,59703.08,2023-05-11,Shoulder control effect practice.
TR0844,AC051,DODFX,deposit,76891.97,2023-05-29,Such difference task coach.
TR0845,AC051,DODFX,transfer,86303.06,2023-01-28,Turn realize effort various nearly.
TR0846,AC051,DODBX,withdrawal,44583.65,2023-04-03,Discuss indicate serve.
TR0847,AC051,DODBX,deposit,98747.95,2023-07-03,Each door floor participant.
TR0848,AC051,DODFX,sell,82592.94,2024-01-22,Phone impact majority and eye.
TR0849,AC051,DODWX,buy,25520.94,2024-01-29,Little certain lay might political.
TR0850,AC051,DODWX,transfer,15987.14,2023-02-23,Religious set run dinner better.
TR0851,AC051,DODFX,sell,17370.24,2024-04-29,Offer song impact.
TR0852,AC051,DODGX,buy,97425.89,2023-12-03,Pm yes remain protect month house television.
TR0853,AC051,DODLX,deposit,87875.2,2024-01-19,Common crime opportunity high.
TR0854,AC051,DODWX,dividend reinvestment,651.06,2024-04-25,Why point bag structure through.
TR0855,AC052,DODLX,withdrawal,1379.41,2023-07-31,Catch direction within west positive floor PM.
TR0856,AC052,DODWX,buy,11316.81,2024-01-08,Expect understand according large vote.
TR0857,AC052,DODBX,deposit,18924.93,2023-07-15,Threat century believe skin see night wide worry.
TR0858,AC052,DODWX,buy,78654.14,2023-03-30,Other similar sister upon.
TR0859,AC052,DODGX,buy,57742.31,2023-10-14,Conference card member keep.
TR0860,AC052,DODWX,sell,83170.82,2023-08-30,Operation really see.
TR0861,AC052,DODFX,dividend reinvestment,11853.0,2023-02-13,Employee sit several ground foreign.
TR0862,AC052,DODGX,buy,97298.71,2023-05-03,Old minute figure.
TR0863,AC052,DODLX,dividend reinvestment,36850.96,2023-10-14,Up home mention money.
TR0864,AC052,DODFX,sell,87608.83,2023-11-26,Himself during according around character administration decide.
TR0865,AC052,DODBX,transfer,60219.27,2023-09-09,Threat large make compare car expect board.
TR0866,AC052,DODIX,sell,53943.4,2023-08-12,Sing add girl nature marriage serve.
TR0867,AC052,DODFX,sell,35480.04,2023-01-06,Year thing democratic capital.
TR0868,AC053,DODIX,sell,30596.46,2024-01-21,Art tell Democrat where grow beautiful.
TR0869,AC053,DODGX,buy,4738.49,2023-05-13,Help quite mission study yet culture.
TR0870,AC053,DODWX,buy,69501.99,2023-04-06,Arm candidate financial simple week.
TR0871,AC053,DODGX,buy,37701.71,2023-12-25,Nearly live film provide process possible blue part.
TR0872,AC053,DODIX,buy,64947.33,2024-01-18,Fund lot great the four also international.
TR0873,AC053,DODGX,dividend reinvestment,65688.02,2024-01-16,News range more boy memory TV.
TR0874,AC053,DODIX,withdrawal,45489.97,2024-05-14,President another crime measure full network college certainly.
TR0875,AC053,DODWX,withdrawal,28413.98,2023-06-22,Need hold road expect hear nor few help.
TR0876,AC053,DODIX,sell,4388.2,2023-02-17,Land stay happy ground environment just our dream.
TR0877,AC053,DODBX,withdrawal,28363.92,2023-03-30,Friend feeling style single president month.
TR0878,AC053,DODBX,dividend reinvestment,88415.35,2023-01-02,Market book involve tend.
TR0879,AC053,DODGX,withdrawal,30596.09,2023-09-08,How yourself yourself report serious social.
TR0880,AC053,DODFX,withdrawal,9416.71,2024-01-03,Main recent speak front international prepare land.
TR0881,AC053,DODLX,sell,55543.39,2023-01-06,Feeling fact material rich time financial often.
TR0882,AC053,DODLX,sell,8138.45,2023-10-03,Guy power significant rule some attorney.
TR0883,AC053,DODLX,transfer,7237.36,2024-02-24,Indeed process same find type experience.
TR0884,AC054,DODWX,sell,51826.39,2023-06-19,Whom reason must produce phone room agent.
TR0885,AC054,DODIX,withdrawal,97110.75,2023-11-19,Thousand let thousand what long dog serious watch.
TR0886,AC054,DODIX,withdrawal,52042.75,2024-03-11,Matter example knowledge ground.
TR0887,AC054,DODWX,deposit,8928.21,2023-05-02,Clearly act already life they few.
TR0888,AC054,DODFX,withdrawal,29129.78,2023-01-17,Price energy hundred.
TR0889,AC054,DODLX,buy,99000.1,2023-07-08,Protect believe leg election.
TR0890,AC054,DODLX,withdrawal,96653.19,2023-11-30,Town town large once one culture.
TR0891,AC054,DODLX,withdrawal,83135.21,2023-12-19,Loss myself fish today care compare edge generation.
TR0892,AC054,DODLX,deposit,27720.88,2024-02-25,Under claim interview member group debate.
TR0893,AC054,DODIX,transfer,4186.8,2023-06-04,Student or year modern truth world.
TR0894,AC054,DODLX,transfer,81700.81,2024-01-06,West boy avoid key range add.
TR0895,AC054,DODIX,deposit,64872.65,2023-08-30,Here of sell leader mean financial.
TR0896,AC054,DODGX,sell,68090.3,2023-03-12,Success federal event answer detail.
TR0897,AC054,DODLX,withdrawal,41733.57,2023-01-26,Couple range respond.
TR0898,AC054,DODIX,withdrawal,38628.56,2023-02-19,Make government soldier off inside before read.
TR0899,AC054,DODWX,buy,43161.93,2023-08-20,Down protect give young billion leave.
TR0900,AC054,DODBX,withdrawal,40269.85,2023-03-19,Go down election school future environmental.
TR0901,AC054,DODIX,withdrawal,47431.3,2023-04-17,Me some partner when indeed.
TR0902,AC054,DODFX,withdrawal,58748.71,2023-11-14,Loss week other computer gas.
TR0903,AC054,DODBX,dividend reinvestment,26621.07,2023-12-26,Thought herself us cost ahead focus rate.
